{"change":"review-history-aware-rechecks","review":{"kind":"semantic-spec-review","reviewer":{"type":"llm","name":"codex-cli","version":"gpt-5"},"promptVersion":"openspec-semantic-traceability-line-ids-v1","reviewedAt":"2026-08-20T11:47:53Z","overall":"pass"},"passingJudgment":{"coverage":"sufficient","scope":"in_scope","minimality":"minimal","rationale":"The requirements collectively specify the declared history-aware recheck behavior without introducing a separate product capability."},"capabilities":[{"path":"review-bot/review-rechecks","capabilityLine":20,"judgment":{"coverage":"sufficient","scope":"in_scope","minimality":"minimal","rationale":"The requirements cover conversation snapshots, finding identity and matching, recheck classification, mutation planning, freshness, and replay safety."},"links":[{"id":"select-review-mode-from-owned-history","proposalLines":[3,20],"specStartLine":7,"judgment":{"coverage":"sufficient","scope":"in_scope","minimality":"minimal","rationale":"Owned history deterministically distinguishes initial discovery from rechecking prior findings."}},{"id":"retain-canonical-provider-conversation","proposalLines":[7,8],"specStartLine":26,"judgment":{"coverage":"sufficient","scope":"in_scope","minimality":"minimal","rationale":"The versioned normalized snapshot supplies the complete, deterministic, auditable conversation required by the proposal."}},{"id":"assign-stable-finding-identities","proposalLines":[10,20],"specStartLine":45,"judgment":{"coverage":"sufficient","scope":"in_scope","minimality":"minimal","rationale":"Stable owned identities cover both inline and summary findings while preventing copied markers from establishing ownership."}},{"id":"match-legacy-findings-conservatively","proposalLines":[10,20],"specStartLine":60,"judgment":{"coverage":"sufficient","scope":"in_scope","minimality":"minimal","rationale":"Unique provider-backed matching and an ambiguous fallback implement the proposed conservative legacy handling."}},{"id":"restrict-rechecks-to-prior-findings","proposalLines":[3,10,11],"specStartLine":75,"judgment":{"coverage":"sufficient","scope":"in_scope","minimality":"minimal","rationale":"Rechecks are limited to owned prior identities while initial review retains the proposed new-finding state."}},{"id":"classify-targets-with-current-head-evidence","proposalLines":[11,41],"specStartLine":90,"judgment":{"coverage":"sufficient","scope":"in_scope","minimality":"minimal","rationale":"The four recheck outcomes require affirmative current-head evidence and reject absence, movement, replies, or resolution as proof."}},{"id":"plan-recheck-mutations","proposalLines":[12,14],"specStartLine":113,"judgment":{"coverage":"sufficient","scope":"in_scope","minimality":"minimal","rationale":"The action mapping follows the proposed reply, general-comment, ambiguity, and no-resolution rules."}},{"id":"guard-rechecks-with-head-and-history","proposalLines":[13,20],"specStartLine":132,"judgment":{"coverage":"sufficient","scope":"in_scope","minimality":"minimal","rationale":"Fresh head and conversation checks prevent stale mutations and conservatively stop a partially executed plan."}},{"id":"make-recheck-mutations-replay-safe","proposalLines":[14,20],"specStartLine":151,"judgment":{"coverage":"sufficient","scope":"in_scope","minimality":"minimal","rationale":"Deterministic action identities, provider lookup, and read-back provide the required identical-rerun idempotency."}}]},{"path":"github-integration","capabilityLine":24,"judgment":{"coverage":"sufficient","scope":"in_scope","minimality":"minimal","rationale":"The requirements provide the provider reads, identity verification, reply and comment contracts, read-back, and failure evidence needed by rechecks."},"links":[{"id":"mint-fresh-installation-token","proposalLines":[24,35],"specStartLine":3,"judgment":{"coverage":"sufficient","scope":"in_scope","minimality":"minimal","rationale":"Fresh, narrowly scoped installation-token behavior preserves the provider-authentication invariant required for every run."}},{"id":"post-initial-review-at-head","proposalLines":[14,35],"specStartLine":18,"judgment":{"coverage":"sufficient","scope":"in_scope","minimality":"minimal","rationale":"Exact-head posting and provider read-back preserve the initial-review behavior on which later rechecks depend."}},{"id":"verify-github-app-identity","proposalLines":[24,33],"specStartLine":35,"judgment":{"coverage":"sufficient","scope":"in_scope","minimality":"minimal","rationale":"Provider-verified App identity is the minimum reliable basis for ownership and loop prevention."}},{"id":"fetch-paginated-rest-history","proposalLines":[7,24],"specStartLine":46,"judgment":{"coverage":"sufficient","scope":"in_scope","minimality":"minimal","rationale":"All REST history surfaces are paginated to completion and fail closed when completeness cannot be established."}},{"id":"fetch-graphql-review-threads","proposalLines":[7,8,24],"specStartLine":61,"judgment":{"coverage":"sufficient","scope":"in_scope","minimality":"minimal","rationale":"Independent thread and comment pagination supplies exposed resolution state while preserving unknown state for incomplete data."}},{"id":"reply-to-top-level-review-comments","proposalLines":[12,24],"specStartLine":76,"judgment":{"coverage":"sufficient","scope":"in_scope","minimality":"minimal","rationale":"The provider reply contract targets only a validated top-level review comment and rejects reply-to-reply mutation."}},{"id":"create-general-status-comments","proposalLines":[12,24],"specStartLine":91,"judgment":{"coverage":"sufficient","scope":"in_scope","minimality":"minimal","rationale":"General pull-request comments cover owned findings that lack a replyable inline thread without inventing a diff location."}},{"id":"read-created-provider-objects-back","proposalLines":[14,24],"specStartLine":102,"judgment":{"coverage":"sufficient","scope":"in_scope","minimality":"minimal","rationale":"Read-back verifies authorship, marker, relationship, identity, and URL before completion is claimed."}},{"id":"preserve-sanitized-provider-failures","proposalLines":[33,34],"specStartLine":113,"judgment":{"coverage":"sufficient","scope":"in_scope","minimality":"minimal","rationale":"Sanitized REST and GraphQL failure evidence makes incomplete provider operations auditable without retaining secrets."}}]},{"path":"review-posting","capabilityLine":25,"judgment":{"coverage":"sufficient","scope":"in_scope","minimality":"minimal","rationale":"The requirements separate classification, planning, and mutation while adding stable markers, freshness checks, status actions, and idempotency."},"links":[{"id":"post-one-item-per-finding","proposalLines":[10,25],"specStartLine":3,"judgment":{"coverage":"sufficient","scope":"in_scope","minimality":"minimal","rationale":"Separately identified inline and summary items preserve a stable identity for every initial finding."}},{"id":"preserve-mode-specific-review-events","proposalLines":[25,35],"specStartLine":10,"judgment":{"coverage":"sufficient","scope":"in_scope","minimality":"minimal","rationale":"Initial review preserves risk-based events while recheck mode uses only per-finding status actions."}},{"id":"validate-output-before-posting","proposalLines":[11,13,25],"specStartLine":25,"judgment":{"coverage":"sufficient","scope":"in_scope","minimality":"minimal","rationale":"Schema, ownership, head, and history validation prevent invalid or stale plans from reaching mutation."}},{"id":"separate-classification-planning-mutation","proposalLines":[12,25],"specStartLine":50,"judgment":{"coverage":"sufficient","scope":"in_scope","minimality":"minimal","rationale":"Separate retained artifacts and gated interfaces directly implement the proposed separation of classification from mutation."}},{"id":"mark-runs-findings-and-actions","proposalLines":[10,25],"specStartLine":65,"judgment":{"coverage":"sufficient","scope":"in_scope","minimality":"minimal","rationale":"Versioned deterministic markers provide stable identities for initial runs, findings, and recheck actions."}},{"id":"preserve-review-history-and-resolution","proposalLines":[12,14,41],"specStartLine":80,"judgment":{"coverage":"sufficient","scope":"in_scope","minimality":"minimal","rationale":"Status actions append to owned conversations without resolving threads or editing, deleting, or relocating prior findings."}},{"id":"prevent-duplicate-reviews-and-statuses","proposalLines":[14,25],"specStartLine":95,"judgment":{"coverage":"sufficient","scope":"in_scope","minimality":"minimal","rationale":"Complete-conversation identity checks skip completed actions and fail closed on conflicting duplicates."}}]},{"path":"agent-pipeline","capabilityLine":26,"judgment":{"coverage":"sufficient","scope":"in_scope","minimality":"minimal","rationale":"The pipeline supplies bounded attributed evidence to reviewers and complete history and validation policy to the coordinator."},"links":[{"id":"run-mode-selected-reviewers-concurrently","proposalLines":[26,32,34],"specStartLine":3,"judgment":{"coverage":"sufficient","scope":"in_scope","minimality":"minimal","rationale":"Mode-specific selection, bounded concurrency, deterministic ordering, and explicit failure handling preserve auditable execution."}},{"id":"feed-attributed-results-to-coordinator","proposalLines":[9,11,26],"specStartLine":34,"judgment":{"coverage":"sufficient","scope":"in_scope","minimality":"minimal","rationale":"The coordinator receives attributed reviewer results plus the complete recheck context needed to detect omissions and unknown identities."}},{"id":"limit-coordinator-discovery-by-mode","proposalLines":[10,11,26],"specStartLine":69,"judgment":{"coverage":"sufficient","scope":"in_scope","minimality":"minimal","rationale":"Initial review may consolidate findings, while recheck coordination cannot turn evidence into an unauthorized new defect."}},{"id":"assign-mode-specific-severity-and-verdict","proposalLines":[11,26,35],"s